date,title,url
2021年12月19日,UK Man Builds Model Train with 1 Kilometer of Tracks,https://engoo.com.tw/app/daily-news/article/uk-man-builds-model-train-with-1-kilometer-of-tracks/Y-y2Vl6rEey-riMkm7WgAA
2021年8月29日,What to See in Egypt Beyond The Pyramids,https://engoo.com.tw/app/daily-news/article/what-to-see-in-egypt-beyond-the-pyramids/aJ9VrOX1Eeu-Dnfl2BUUsQ
2021年6月21日,UK Woman Knits Huge Model of Queen's Winter Home,https://engoo.com.tw/app/daily-news/article/uk-woman-knits-huge-model-of-queens-winter-home/iKta3M7JEeuXmQdvamJhuQ
2021年4月11日,Egypt Holds Parade with Royal Mummies ,https://engoo.com.tw/app/daily-news/article/egypt-holds-parade-with-royal-mummies/txLTWph9EeuJrXdQqX7bNw
2021年11月23日,Forbes Releases List of Highest-Paid Dead Celebrities,https://engoo.com.tw/app/daily-news/article/forbes-releases-list-of-highest-paid-dead-celebrities/u43BQkgEEeyyKXtM5fmrUA
2021年4月11日,"Prince Philip, Husband of Queen Elizabeth II, Dies",https://engoo.com.tw/app/daily-news/article/prince-philip-husband-of-queen-elizabeth-ii-dies/uIK_WplWEeuC2vf7Gl7fyg
2021年9月27日,Egypt to Get First High-Speed Electric Rail Line,https://engoo.com.tw/app/daily-news/article/egypt-to-get-first-high-speed-electric-rail-line/KZ85LBrxEeyZ7C_HD5YeQw
2021年5月22日,Virgin Hyperloop May Carry Passengers by 2027 ,https://engoo.com.tw/app/daily-news/article/virgin-hyperloop-may-carry-passengers-by-2027/a1WlArfFEeugeVP6IcKSFw
2021年4月17日,Famous Egyptian Archaeologist Shares Details of Lost City,https://engoo.com.tw/app/daily-news/article/famous-egyptian-archaeologist-shares-details-of-lost-city/BTP87px6Eeupe2f5vwN9XQ
2021年8月18日,"Piece of Royal Wedding Cake Sells for Over $2,000",https://engoo.com.tw/app/daily-news/article/piece-of-royal-wedding-cake-sells-for-over-2000/KAxALPs6EeuvLHfqP5iX5A
2021年2月23日,Ancient Beer Factory Found in Egypt,https://engoo.com.tw/app/daily-news/article/ancient-beer-factory-found-in-egypt/qF1bEnLcEeuWc4tdnux0ig
2021年5月22日,Fighter Conor McGregor Named Highest-Paid Athlete,https://engoo.com.tw/app/daily-news/article/fighter-conor-mcgregor-named-highest-paid-athlete/TNdajrfaEeuDboOlFhaKpA
2021年10月15日,Trump Leaves Forbes 400 Rich List For First Time In Decades,https://engoo.com.tw/app/daily-news/article/trump-leaves-forbes-400-rich-list-for-first-time-in-decades/-Zkk1igBEeyia7czqBAzlg
2021年10月30日,Paris Wants to Become 'Cycling City' by 2026,https://engoo.com.tw/app/daily-news/article/paris-wants-to-become-cycling-city-by-2026/9QnI9DcAEeydRt9mxCd7cQ
2021年6月25日,Which Celebrities Made the Most Money in 2020? ,https://engoo.com.tw/app/daily-news/article/which-celebrities-made-the-most-money-in-2020/SDQI8M-REeuWmB99p4F3ZQ
2021年5月20日,Oprah and Prince Harry Announce Mental Health Show,https://engoo.com.tw/app/daily-news/article/oprah-and-prince-harry-announce-mental-health-show/ZxDLTLHREeutNmcInQHrlQ
